title,description,genre
Inception,A thief who steals corporate secrets through dream-sharing technology.,Sci-Fi
Interstellar,A team travels through a wormhole in space to save humanity.,Sci-Fi
The Dark Knight,Batman fights the Joker in Gotham City.,Action
Titanic,A love story aboard a doomed ship.,Romance
Avengers,A group of superheroes save the world from alien invasion.,Action
La La Land,A musician and actress fall in love while pursuing dreams.,Romance
The Matrix,A hacker discovers reality is a simulation.,Sci-Fi